{
  "declaration_schema_version": "1.0",
  "generated_at": "2026-04-05T13:05:42.518082Z",
  "implementation": {
    "implementation_id": "oaps-python",
    "implementation_version": "0.1.0",
    "metadata": {
      "issues": [],
      "issues_present": false,
      "mode": "fixture-check",
      "requested_scenarios": [],
      "requested_scopes": []
    }
  },
  "issues": [],
  "manifest_id": "oaps-tck",
  "scope_declarations": [
    {
      "coverage_observed": [
        "schema",
        "fixture"
      ],
      "error": 0,
      "evaluated_scenario_ids": [
        "core.actor.valid"
      ],
      "evaluated_scenarios": 1,
      "fail": 1,
      "known_scenario_ids": [
        "core.actor.valid",
        "core.capability.valid",
        "core.intent.valid",
        "core.intent.invalid.invoke-missing-arguments",
        "core.task.valid",
        "core.delegation.valid",
        "core.delegation.expired",
        "core.mandate.valid",
        "core.approval-request.valid",
        "core.approval-decision.valid",
        "core.challenge.valid",
        "core.interaction-transition.valid",
        "core.execution-result.valid",
        "core.evidence-event.valid",
        "core.evidence.chain.verifiable",
        "core.evidence.tamper-detected",
        "core.evidence.prev-hash-mismatch",
        "core.evidence.hash-stable",
        "core.error-object.valid",
        "core.extension-descriptor.valid",
        "core.task-transition.valid",
        "core.interaction-transition.invalid.completed-to-executing",
        "core.task-transition.invalid.completed-to-running",
        "core.intent.task-promotion",
        "core.reject-vs-revoke.distinct"
      ],
      "known_scenarios": 25,
      "pass": 0,
      "scope": "core",
      "selected_in_result": true,
      "skip": 0,
      "status": "incompatible"
    },
    {
      "coverage_observed": [],
      "error": 0,
      "evaluated_scenario_ids": [],
      "evaluated_scenarios": 0,
      "fail": 0,
      "known_scenario_ids": [
        "http.authentication.required",
        "http.authentication.failed",
        "http.discovery.well-known",
        "http.discovery.actor-card",
        "http.discovery.capabilities",
        "http.interaction.created",
        "http.interaction.not-found",
        "http.interaction.updated",
        "http.messages.append",
        "http.messages.subject-binding",
        "http.messages.interaction-id-mismatch",
        "http.evidence.retrieval",
        "http.evidence.replay-window",
        "http.events.retrieval",
        "http.events.replay-window",
        "http.events.replay-window.edge-cases",
        "http.events.replay-cursor-invalid",
        "http.approval.decision",
        "http.approval.not-pending",
        "http.approval.rejection",
        "http.approval.rejection.retrieval",
        "http.idempotency.reuse",
        "http.idempotency.messages.reuse",
        "http.idempotency.messages.conflict",
        "http.idempotency.approval.reuse",
        "http.idempotency.rejection.reuse",
        "http.idempotency.revocation.reuse",
        "http.version.negotiation",
        "http.error.authentication-required",
        "http.error.interaction-not-found",
        "http.error.approval-not-pending",
        "http.error.idempotency-conflict",
        "http.error.replay-cursor-not-found",
        "http.revocation.request",
        "http.revocation.retrieval",
        "http.events.replay.after-approve",
        "http.events.replay.after-reject",
        "http.events.replay.after-revoke"
      ],
      "known_scenarios": 38,
      "pass": 0,
      "scope": "binding:http",
      "selected_in_result": false,
      "skip": 0,
      "status": "not_evaluated"
    },
    {
      "coverage_observed": [],
      "error": 0,
      "evaluated_scenario_ids": [],
      "evaluated_scenarios": 0,
      "fail": 0,
      "known_scenario_ids": [
        "jsonrpc.discovery.request-response",
        "jsonrpc.discovery.response-shape",
        "jsonrpc.interactions.create",
        "jsonrpc.messages.append",
        "jsonrpc.approval.approve",
        "jsonrpc.approval.reject",
        "jsonrpc.revocation.request",
        "jsonrpc.events.list",
        "jsonrpc.error.mapping",
        "jsonrpc.idempotency.keyed-mutations",
        "jsonrpc.correlation.ids",
        "jsonrpc.notifications.progress-update"
      ],
      "known_scenarios": 12,
      "pass": 0,
      "scope": "binding:jsonrpc",
      "selected_in_result": false,
      "skip": 0,
      "status": "not_evaluated"
    },
    {
      "coverage_observed": [],
      "error": 0,
      "evaluated_scenario_ids": [],
      "evaluated_scenarios": 0,
      "fail": 0,
      "known_scenario_ids": [
        "grpc.service.layout",
        "grpc.discovery.unary",
        "grpc.interactions.create.unary",
        "grpc.messages.append.unary",
        "grpc.approval.approve.unary",
        "grpc.approval.reject.unary",
        "grpc.revocation.unary",
        "grpc.events.list.unary",
        "grpc.events.watch.streaming",
        "grpc.evidence.watch.streaming",
        "grpc.metadata.headers",
        "grpc.idempotency.metadata-key",
        "grpc.error.status-mapping"
      ],
      "known_scenarios": 13,
      "pass": 0,
      "scope": "binding:grpc",
      "selected_in_result": false,
      "skip": 0,
      "status": "not_evaluated"
    },
    {
      "coverage_observed": [],
      "error": 0,
      "evaluated_scenario_ids": [],
      "evaluated_scenarios": 0,
      "fail": 0,
      "known_scenario_ids": [
        "mcp.actor-card.mapping",
        "mcp.capability-card.mapping",
        "mcp.intent.execution",
        "mcp.policy.gating",
        "mcp.approval.insertion",
        "mcp.error.translation",
        "mcp.evidence.emission"
      ],
      "known_scenarios": 7,
      "pass": 0,
      "scope": "profile:mcp",
      "selected_in_result": false,
      "skip": 0,
      "status": "not_evaluated"
    },
    {
      "coverage_observed": [],
      "error": 0,
      "evaluated_scenario_ids": [],
      "evaluated_scenarios": 0,
      "fail": 0,
      "known_scenario_ids": [
        "a2a.task.lifecycle.preservation",
        "a2a.delegation.carryover",
        "a2a.approval.interposition",
        "a2a.message.evidence.carryover"
      ],
      "known_scenarios": 4,
      "pass": 0,
      "scope": "profile:a2a",
      "selected_in_result": false,
      "skip": 0,
      "status": "not_evaluated"
    },
    {
      "coverage_observed": [],
      "error": 0,
      "evaluated_scenario_ids": [],
      "evaluated_scenarios": 0,
      "fail": 0,
      "known_scenario_ids": [
        "auth-web.discovery.identity",
        "auth-web.subject-binding.actor-card",
        "auth-web.subject-binding.message-append",
        "auth-web.delegation.fail-closed"
      ],
      "known_scenarios": 4,
      "pass": 0,
      "scope": "profile:auth-web",
      "selected_in_result": false,
      "skip": 0,
      "status": "not_evaluated"
    },
    {
      "coverage_observed": [],
      "error": 0,
      "evaluated_scenario_ids": [],
      "evaluated_scenarios": 0,
      "fail": 0,
      "known_scenario_ids": [
        "auth-fides-tap.attestation.actor-card",
        "auth-fides-tap.trust-upgrade.delegation",
        "auth-fides-tap.evidence.approval-boundary"
      ],
      "known_scenarios": 3,
      "pass": 0,
      "scope": "profile:auth-fides-tap",
      "selected_in_result": false,
      "skip": 0,
      "status": "not_evaluated"
    },
    {
      "coverage_observed": [],
      "error": 0,
      "evaluated_scenario_ids": [],
      "evaluated_scenarios": 0,
      "fail": 0,
      "known_scenario_ids": [
        "x402.payment.discovery",
        "x402.payment.authorization.intent",
        "x402.settlement.execution-result"
      ],
      "known_scenarios": 3,
      "pass": 0,
      "scope": "profile:x402",
      "selected_in_result": false,
      "skip": 0,
      "status": "not_evaluated"
    },
    {
      "coverage_observed": [],
      "error": 0,
      "evaluated_scenario_ids": [],
      "evaluated_scenarios": 0,
      "fail": 0,
      "known_scenario_ids": [
        "osp.provisioning.actor-card",
        "osp.provisioning.approval-request",
        "osp.lifecycle.execution-result"
      ],
      "known_scenarios": 3,
      "pass": 0,
      "scope": "profile:osp",
      "selected_in_result": false,
      "skip": 0,
      "status": "not_evaluated"
    }
  ],
  "selected_scopes": [
    "core"
  ],
  "source_result": {
    "executed_at": "2026-04-05T01:22:50Z",
    "result_path": "/Users/efebarandurmaz/OAPS/conformance/results/examples/fixture-check-core-incompatible.v1.json",
    "runner_id": "oaps-python-fixture-check"
  },
  "suite_version": "foundation-draft",
  "summary": {
    "compatible": 0,
    "incompatible": 1,
    "not_evaluated": 9,
    "partial": 0,
    "total": 10
  }
}
